{
  "schemaVersion": 1,
  "id": "hotel",
  "title": "Hotel",
  "description": "Diálogos cotidianos para praticar interações em hotéis na França.",
  "targetLanguage": "fr-FR",
  "supportLanguage": "pt-BR",
  "practiceRole": "guest",
  "participants": [
    {
      "id": "guest",
      "role": "guest",
      "label": "Hóspede"
    },
    {
      "id": "receptionist",
      "role": "staff",
      "label": "Recepcionista"
    },
    {
      "id": "concierge",
      "role": "staff",
      "label": "Concierge"
    },
    {
      "id": "housekeeping",
      "role": "staff",
      "label": "Funcionário da governança"
    },
    {
      "id": "breakfast-server",
      "role": "staff",
      "label": "Atendente do café da manhã"
    },
    {
      "id": "porter",
      "role": "staff",
      "label": "Mensageiro"
    }
  ],
  "dialogues": [
    {
      "id": "hotel-d01",
      "title": "Arrivée avec réservation",
      "type": "core",
      "context": "O hóspede chega ao hotel para fazer o check-in de uma reserva já confirmada. O atendimento ocorre sem imprevistos.",
      "participantIds": [
        "guest",
        "receptionist"
      ],
      "tags": [
        "check-in",
        "com-reserva",
        "wifi",
        "cafe-da-manha"
      ],
      "turns": [
        {
          "id": "hotel-d01-t01",
          "speakerId": "receptionist",
          "speakerRole": "staff",
          "isLearnerTurn": false,
          "targetText": "Bonjour, bienvenue. Vous avez une réservation ?",
          "translation": "Bom dia, seja bem-vindo. O senhor tem reserva?",
          "intention": "Cumprimentar e verificar se há reserva."
        },
        {
          "id": "hotel-d01-t02",
          "speakerId": "guest",
          "speakerRole": "guest",
          "isLearnerTurn": true,
          "targetText": "Oui, au nom de Santos.",
          "translation": "Sim, no nome de Santos.",
          "intention": "Confirmar a reserva e informar o nome.",
          "alternatives": [
            {
              "targetText": "Oui, j'ai réservé au nom de Rodrigo Santos.",
              "translation": "Sim, fiz a reserva no nome de Rodrigo Santos."
            },
            {
              "targetText": "Oui, la réservation a été faite par mon entreprise.",
              "translation": "Sim, a reserva foi feita pela minha empresa."
            },
            {
              "targetText": "Je crois que c'est au nom de Santos.",
              "translation": "Acho que está no nome de Santos."
            }
          ]
        },
        {
          "id": "hotel-d01-t03",
          "speakerId": "receptionist",
          "speakerRole": "staff",
          "isLearnerTurn": false,
          "targetText": "Très bien. Vous pouvez me montrer une pièce d'identité, s'il vous plaît ?",
          "translation": "Certo. Pode me mostrar um documento de identidade, por favor?",
          "intention": "Pedir um documento de identificação."
        },
        {
          "id": "hotel-d01-t04",
          "speakerId": "guest",
          "speakerRole": "guest",
          "isLearnerTurn": true,
          "targetText": "Bien sûr, voici mon passeport.",
          "translation": "Claro, aqui está meu passaporte.",
          "intention": "Entregar o documento solicitado.",
          "alternatives": [
            {
              "targetText": "Oui, un instant... Voilà.",
              "translation": "Sim, só um instante... Aqui está."
            },
            {
              "targetText": "Est-ce que ma carte d'identité suffit ?",
              "translation": "Minha carteira de identidade serve?"
            },
            {
              "targetText": "Je l'ai dans mon sac, je vous le donne tout de suite.",
              "translation": "Está na minha bolsa, já pego para você."
            }
          ]
        },
        {
          "id": "hotel-d01-t05",
          "speakerId": "receptionist",
          "speakerRole": "staff",
          "isLearnerTurn": false,
          "targetText": "Merci. Vous restez bien trois nuits, jusqu'à lundi ?",
          "translation": "Obrigado. O senhor fica três noites, até segunda, certo?",
          "intention": "Confirmar a duração da estadia."
        },
        {
          "id": "hotel-d01-t06",
          "speakerId": "guest",
          "speakerRole": "guest",
          "isLearnerTurn": true,
          "targetText": "Oui, c'est bien ça.",
          "translation": "Sim, isso mesmo.",
          "intention": "Confirmar as datas da reserva."
        },
        {
          "id": "hotel-d01-t07",
          "speakerId": "receptionist",
          "speakerRole": "staff",
          "isLearnerTurn": false,
          "targetText": "Le petit-déjeuner est servi de 7 heures à 10 heures, au rez-de-chaussée.",
          "translation": "O café da manhã é servido das 7h às 10h, no térreo.",
          "intention": "Informar horário e local do café da manhã."
        },
        {
          "id": "hotel-d01-t08",
          "speakerId": "guest",
          "speakerRole": "guest",
          "isLearnerTurn": true,
          "targetText": "D'accord. Et le Wi-Fi, comment ça marche ?",
          "translation": "Certo. E como funciona o Wi-Fi?",
          "intention": "Pedir informações sobre o Wi-Fi.",
          "alternatives": [
            {
              "targetText": "Très bien. Le mot de passe du Wi-Fi est indiqué quelque part ?",
              "translation": "Ótimo. A senha do Wi-Fi está indicada em algum lugar?"
            },
            {
              "targetText": "Merci. Le Wi-Fi est gratuit dans les chambres ?",
              "translation": "Obrigado. O Wi-Fi é gratuito nos quartos?"
            },
            {
              "targetText": "Parfait, je voulais justement vous demander pour le Wi-Fi.",
              "translation": "Perfeito, eu ia justamente perguntar sobre o Wi-Fi."
            }
          ]
        },
        {
          "id": "hotel-d01-t09",
          "speakerId": "receptionist",
          "speakerRole": "staff",
          "isLearnerTurn": false,
          "targetText": "Il suffit de choisir le réseau de l'hôtel et d'entrer votre numéro de chambre.",
          "translation": "É só selecionar a rede do hotel e digitar o número do quarto.",
          "intention": "Explicar como acessar o Wi-Fi."
        },
        {
          "id": "hotel-d01-t10",
          "speakerId": "guest",
          "speakerRole": "guest",
          "isLearnerTurn": true,
          "targetText": "Très bien, merci.",
          "translation": "Ótimo, obrigado.",
          "intention": "Agradecer pela explicação."
        },
        {
          "id": "hotel-d01-t11",
          "speakerId": "receptionist",
          "speakerRole": "staff",
          "isLearnerTurn": false,
          "targetText": "Voici votre carte. Vous êtes au quatrième étage, chambre 412.",
          "translation": "Aqui está seu cartão. O senhor fica no quarto 412, no quarto andar.",
          "intention": "Entregar o cartão-chave e indicar o quarto."
        },
        {
          "id": "hotel-d01-t12",
          "speakerId": "guest",
          "speakerRole": "guest",
          "isLearnerTurn": true,
          "targetText": "Parfait. L'ascenseur est par où ?",
          "translation": "Perfeito. Onde fica o elevador?",
          "intention": "Pedir orientação para chegar ao quarto.",
          "alternatives": [
            {
              "targetText": "Merci. C'est bien par là, l'ascenseur ?",
              "translation": "Obrigado. O elevador é por ali mesmo?"
            },
            {
              "targetText": "D'accord. Je peux prendre l'ascenseur juste à gauche ?",
              "translation": "Certo. Posso pegar o elevador logo à esquerda?"
            },
            {
              "targetText": "Très bien, je vais trouver. Merci beaucoup.",
              "translation": "Tudo bem, eu encontro. Muito obrigado."
            }
          ]
        },
        {
          "id": "hotel-d01-t13",
          "speakerId": "receptionist",
          "speakerRole": "staff",
          "isLearnerTurn": false,
          "targetText": "Juste à votre gauche. Bon séjour !",
          "translation": "Logo à sua esquerda. Boa estadia!",
          "intention": "Dar a orientação e encerrar o atendimento."
        },
        {
          "id": "hotel-d01-t14",
          "speakerId": "guest",
          "speakerRole": "guest",
          "isLearnerTurn": true,
          "targetText": "Merci, bonne journée.",
          "translation": "Obrigado, bom dia.",
          "intention": "Agradecer e se despedir."
        }
      ],
      "reusableStructures": [
        {
          "targetText": "J'ai une réservation au nom de...",
          "translation": "Tenho uma reserva no nome de...",
          "exampleTarget": "J'ai une réservation au nom de Martin.",
          "exampleTranslation": "Tenho uma reserva no nome de Martin."
        },
        {
          "targetText": "Vous pouvez me montrer... ?",
          "translation": "Pode me mostrar...?",
          "exampleTarget": "Vous pouvez me montrer votre confirmation ?",
          "exampleTranslation": "Pode me mostrar sua confirmação?"
        },
        {
          "targetText": "Vous restez bien... ?",
          "translation": "O senhor fica... mesmo?",
          "exampleTarget": "Vous restez bien deux nuits ?",
          "exampleTranslation": "O senhor fica duas noites mesmo?"
        },
        {
          "targetText": "Il suffit de...",
          "translation": "É só...",
          "exampleTarget": "Il suffit de présenter votre carte.",
          "exampleTranslation": "É só apresentar seu cartão."
        },
        {
          "targetText": "C'est par où ?",
          "translation": "Onde fica?",
          "exampleTarget": "La salle du petit-déjeuner, c'est par où ?",
          "exampleTranslation": "Onde fica a sala do café da manhã?"
        }
      ]
    },
    {
      "id": "hotel-d02",
      "title": "Une chambre pour ce soir",
      "type": "core",